{
  "$schema": "https://json-schema.org/draft/2020-12/schema",
  "$id": "p1008://formula-registry/v1.2/ud_research_review_decision",
  "type": "object",
  "required": [
    "recordType", "recordVersion", "decisionId", "decisionDate",
    "ownerApprovalReference", "formulaId", "decisionSemantics",
    "productionSnapshot", "provenanceEvidence", "mathematicalBehavior",
    "canonicalBacktest", "researchCandidates", "limitations",
    "exploratoryOutcomeEvidence", "futureReconsiderationEvidence",
    "invariantProtection", "authorityProtection", "codeProtection",
    "baselineCommitSha", "recordCommitSha", "commitStatus",
    "candidateActivationAuthorized", "actionable", "formalDecision",
    "productionFormulaChange"
  ],
  "properties": {
    "$schema": {"type": "string"},
    "recordType": {"const": "P1008_UD_RESEARCH_REVIEW_DECISION"},
    "recordVersion": {"const": "1.0"},
    "decisionId": {"type": "string", "minLength": 1},
    "decisionDate": {"type": "string", "format": "date"},
    "ownerApprovalReference": {"type": "string", "minLength": 1},
    "formulaId": {"const": "MIDR.UD"},
    "decisionSemantics": {"type": "object"},
    "productionSnapshot": {"type": "object"},
    "provenanceEvidence": {"type": "object"},
    "mathematicalBehavior": {"type": "object"},
    "canonicalBacktest": {"type": "object"},
    "researchCandidates": {"type": "object"},
    "limitations": {"type": "object"},
    "exploratoryOutcomeEvidence": {"type": "object"},
    "futureReconsiderationEvidence": {"type": "array", "minItems": 1},
    "invariantProtection": {"type": "object"},
    "authorityProtection": {"type": "object"},
    "codeProtection": {"type": "object"},
    "baselineCommitSha": {"const": "0f923778342370b89ac5cee02c34c263c98f8919"},
    "recordCommitSha": {"type": ["string", "null"], "pattern": "^[0-9a-f]{40}$"},
    "commitStatus": {"const": "NOT_COMMITTED"},
    "candidateActivationAuthorized": {"const": false},
    "actionable": {"const": false},
    "formalDecision": {"const": false},
    "productionFormulaChange": {"const": false}
  },
  "additionalProperties": false
}
